{
  "$ref": "#/definitions/features",
  "definitions": {
    "features": {
      "type": "object",
      "properties": {
        "name": {
          "type": "string"
        },
        "description": {
          "type": "string"
        },
        "longDescription": {
          "type": "string"
        },
        "status": {
          "type": "string",
          "enum": [
            "available",
            "coming-soon"
          ]
        },
        "icon": {
          "type": "string"
        },
        "order": {
          "type": "number",
          "default": 999
        },
        "$schema": {
          "type": "string"
        }
      },
      "required": [
        "name",
        "description",
        "status"
      ],
      "additionalProperties": false
    }
  },
  "$schema": "http://json-schema.org/draft-07/schema#"
}